short_description,category
"Hard to believe that in 2008 this nation was on one of those, ""most dangerous places in the world"" lists. Not anymore, as things are a hustle and bustle here, with one of the fastest-growing economies in the world today.",TRAVEL
"Last year, when I turned double nickles and my kids flew the nest, I decided to drive cross-country on the second longest highway in the U.S.",TRAVEL
Or so his critics keep hoping.,POLITICS
"Happy commercial-viewing, and, uh, go team!",SPORTS
"""Stick to baseball,"" one commenter sniped.",SPORTS
"We've all been there: You want to finally make your apartment feel like home, but your landlord is so not cool with an eggplant",HOME & LIVING
"It's not too late to back out, Ray.",SPORTS
"Niki Blaker: This designer from Phoenix, Arizona has pinned an eclectic mix of interiors, graphic design, and illustrations",HOME & LIVING
"""Shame on Mr. Petersen for not having attended the universal law school of the airwaves that was 'Law and Order.'""",POLITICS
"By Calin Brown Don Blankenship, the former CEO and chair of Massey Energy, filed federal candidacy papers in December, officially",POLITICS
"Anti-Trump Republican delegates want a ""conscience"" clause as an out from any obligation to vote for him.",POLITICS
There's not a hint of Don Draper in this gorgeous space.,HOME & LIVING
"With the 2015 regular season coming to an end, which coaches and GMs will get their walking papers?",SPORTS
"Twas the night before Knicksmas, when all through the Garden
Not a big man was stirring, not even Rasheed.
The high tops were laced by the lockers with care,
In hopes that St. Knick soon would be there.",SPORTS
"The architectural signature of the games is Cecil Balmond and Anish Kapoor's ArcelorMittal ""Orbit,"" which officially opened",TRAVEL
The Massachusetts senator weighed in on the battle for leadership of the consumer protection agency she helped create.,POLITICS
"Gun policy looms as key threat to president's support, polls find.",POLITICS
"So much for the home of Starbucks. A new Facebook survey has declared the best coffee shops across the country, revealing",TRAVEL
Booking Increase: 79 percent Chance of Getting Hit: Once every 10.85 years Booking Increase: 48 percent Chance of Getting,TRAVEL
"Regardless of your style though, Adler doesn't care, as long as you're not lazy about it. ""I'm not a snob in any way, shape",HOME & LIVING
Very unusual.,HOME & LIVING
"When it comes to the very best European destinations, bigger does not always mean better.",TRAVEL
"""I wish my neighborhood had more ..."" All Suburban Urban Local restaurants 27% 26% 29% Local grocery shopping options 22",HOME & LIVING
"Darren Rovell, just shy of 400,000 followers strong, does not exist on Twitter alone — his return to ESPN after six years",SPORTS
No trips to the party store necessary.,HOME & LIVING
"""We're going to win this ballgame,"" Max Wittek, the Trojans' confident but green (but not in a green jersey way) quarterback",SPORTS
"August 15 was the end of World War II in Asia, 69 years ago, following the atomic bombings of Hiroshima and Nagasaki. I could not find a single reference to the bombings, or to the end of the war itself, anywhere in the American media.",POLITICS
"Forget everything you know about youth hostels -- the squeaky bunks, the communal baths, the dude from Poughkeepsie who's been backpacking for two weeks but has totally seen the world, man, and U.S. imperialism has, like, got to be stopped.",TRAVEL
One of Space City's greatest assets is its close proximity to some of the other most unique and cultured cities.,TRAVEL
"Thanks to small donors, Trump has almost closed his fundraising gap with Clinton.",POLITICS
"Treat it like we treat alcohol, voting, cigarettes and sex.",SPORTS
Ready to throw a party? Take a look at three easy ways to transform your outdoor space into a party-ready space. When preparing,HOME & LIVING
"Whether you're voting for Obama or Romney, these are the Washington, D.C., hot spots where you can drink like a politician -- and maybe even spot a few in action.",TRAVEL
"“The past is never dead. It’s not even past.”  William Faulkner In March 1865, as the Civil War approached its fiery end",POLITICS
"If you complete this checklist, your visitors may never want to leave.",HOME & LIVING
Here's where you can order fish and seafood online if your grocery store is floundering.,HOME & LIVING
"The result (which we belatedly discovered via Fubiz.com): A set of structures designed by 12 architects called ""Architecture",HOME & LIVING
They'd showcase our shoes and clothes beautifully.,HOME & LIVING
Rose is the league's all-time leader in hits.,SPORTS
"Heathrow Airport is taking Christmas to the extreme this year, surprising 24 randomly-chosen passengers with luxury gifts",TRAVEL
"Not all college football teams are treated equally. Some clearly get a pass when it comes to ranking, scheduling, who makes it to bowl games, and even the national championship. There's a clear demarcation between the ""old money"" and the ""nouveau riche.""",SPORTS
"by Andrew Mayersohn Last week, Kansas’ 4th Congressional District nearly produced the first shocking election result of the",POLITICS
Goalies on the U.S. women's ice hockey team may need to ditch the masks because of IOC guidelines.,SPORTS
He's the 16th GOP candidate to officially enter the race.,POLITICS
"It's not always because of ideology, says The Both's Ted Leo -- artists don't want to give up a ""piece of their soul.""",POLITICS
"The Tigers offense got shutout and they never knew what hit them.  A rookie pitcher took the mound, pitched a stellar game and matched up well against one of the best pitchers Major League Baseball.",SPORTS
The extradition of Romanian hacker “Guccifer” to the U.S. at a critical point in the FBI’s criminal investigation of Hillary,POLITICS
Here's what you need to know if you're dropping off your ballot at a polling location or voting in-person in the 2020 presidential election.,HOME & LIVING
"In football, the umpire is generally positioned approximately five yards from the line of scrimmage on the defensive side",SPORTS
"In Italy, we have a problem with beaches: we love bays that look like the Caribbean Islands. But we’re not in the Caribbean",TRAVEL
"The league doesn’t consider it “gambling"" now, but if its legal status “were to change, we would change our view of it.”",SPORTS
"Great as an art medium, produce saver and more!",HOME & LIVING
"Technology has changed the experience of traveling.  With personal devices now our constant companions, the best parts of traveling have disappeared.  Rest assured what's been lost is not that we no longer wear ties and skirts on airplanes and wear sweat pants instead.",TRAVEL
The two were destined to be together from the beginning.,SPORTS
"In general, we tend to think it's best not to insult your host country when traveling abroad. It's just not nice. So before",TRAVEL
"The big news for the skyline of Amsterdam is the arrival of the new Film Museum on the Ij, nicknamed ""The Eye.""",TRAVEL
"Being a self-employed working mom, Dean's daily schedule can be a bit jam-packed. She gets up before dawn to get started",HOME & LIVING
"Plus, it's much more personal than any designer brand.",HOME & LIVING
"Have you ever considered combining a trip to a major world capital with a spot of guerrilla gardening? If so, The Edible Bus Stop project, launched last week in London, could be the ideal opportunity.",TRAVEL
But this vintage Bell Telephone ad got a few things right about the future: That we dial from our handset and enjoy the convenience,HOME & LIVING
"How do far-flung places come to be such tourist hot-spots -- and, perhaps more intriguingly, what are the local consequences?",TRAVEL
"The Lincoln Project ad was directed by Jon Turteltaub, who also directed ""National Treasure"" and ""While You Were Sleeping.""",POLITICS
The potential Oscar nominees you'll be watching this month.,HOME & LIVING
"Once again, baseball writers are about to discriminate against a talented player for merely being the best at his position.  If the sport was more about being a meritocracy, we would have a few more votes for Atlanta Braves relief pitcher Craig Kimbrel for the Cy Young Award.",SPORTS
A-mazing.,HOME & LIVING
"In 1953, American Airlines announced that all female flight attendants would retire at age 32. In 1963, a group of female",TRAVEL
"Take a helicopter, hot air balloon or scenic flight over Africa's desert, plains and thundering falls for unforgettable views of the iconic destinations.",TRAVEL
"Good luck, Jared!",POLITICS
Game recognize game.,SPORTS
"Summertime is fast-approaching and we can't wait till the days of top-down convertibles, cover-ups and flip-flops dress codes",TRAVEL
"Yes, you can decorate a kid's room that's fun and whimsical while still being sophisticated enough for when they grow up",HOME & LIVING
Hint: They'll help you with that ever-growing stack of magazines.,HOME & LIVING
Warning: These photos are not for the faint of heart.,SPORTS
"Bubba Watson starts Saturday's third round of the Masters with a three-shot lead – but defending champion Adam Scott, Jordan",SPORTS
TOP STORIES TWO IOWA POLICE OFFICERS KILLED ‘AMBUSH-STYLE’ The two officers were shot in their separate patrol cars. The,POLITICS
"""Stick Talk,"" to be exact.",SPORTS
"It's easy for a lack of planning to result in stress. However, for us, the opposite happened. We had the advantage of traveling during low season; while some sites were closed, most lodging options, and even the roads, were empty.",TRAVEL
"D.C. isn't falling in love with ""Ryancare.""",POLITICS
"“This is my life. Without health care coverage, I’m dead,"" a constituent tells him.",POLITICS
"""Help me, help me, please!"" Bethanie Mattek-Sands could be heard shouting.",SPORTS
Yet another Republican announces they won't seek re-election.,POLITICS
Unchanneled passion. Blocked energy. A disconnection between heart and mouth. A deep belief in my own unlovability. Themes that babbled through my past amours and my relationship with myself welled up into a pool that I couldn't not gaze into. So I started to look.,TRAVEL
"""I'd probably stay on my couch, crying and eating ice cream ... if he hadn't asked me.""",SPORTS
"In reality, even when countries address similar educational reform issues, policy possibilities and perspectives may vary",HOME & LIVING
"The U.S. flag code says nothing about kneeling, Mr. President",POLITICS
"In the words of Beyonce, ""All the single ladies!""",HOME & LIVING
"Residents have seen rockets, satellites and space shuttles right from their front door.",HOME & LIVING
"LOS ANGELES — Hillary Clinton became the presumptive Democratic nominee on Monday night, but Bernie Sanders still has a big",POLITICS
"A rabble-rouser and a gentleman, a cowboy and a businessman, an artist and a pragmatist.",TRAVEL
NEW YORK (AP) — Kenya's Stanley Biwott and Mary Keitany swept the titles at the New York City Marathon on Sunday. Keitany,SPORTS
His former assistant coach Jerry Sandusky is serving 30 to 60 years in state prison after being convicted of molesting 10 boys.,SPORTS
Fewer than 8 percent of top coaches in the biggest football programs are black.,SPORTS
** Do you have a home story idea or tip? Email us at homesubmissions@huffingtonpost.com. (PR pitches sent to this address,HOME & LIVING
"This is the first indication that the special counsel is beginning to compel witness testimony before the grand jury, the report said.",POLITICS
"The agreement, which was signed off on by the league and players' union, complies with the NFL collective bargaining agreement",SPORTS
Judge Aaron Persky sentenced Turner to six months in jail for sexually assaulting an unconscious woman.,POLITICS
Your TV doesn't have to be the focus of the room -- Kristan shares three great ways to incorporate it into your space.,HOME & LIVING
Introducing... the kitten bobsled.,SPORTS
Yifu Dong reviews a book of memoirs on the Cultural Revolution Memory of the Storm.,POLITICS
"Last spring, when a friend moving to New York offered McDonald his one-bedroom 1930s cottage to use as an office, she jumped",HOME & LIVING
The replacement refs continued to make headlines for the wrong reasons in Week 3. It was unclear whether the play would have,SPORTS
"The former secretary finally got to meet the pope, after he was denied a spot with the president earlier this year.",POLITICS
"With the deal in doubt, Trump is taking his ball and going home.",POLITICS
"The Russians ""made him a lot of money,"" the Mavericks owner said. ""That makes them his friends.""",POLITICS
"Extra points for referring to Donald Trump as ""that guy.""",SPORTS
"If you don't have the budget for The Villa by Barton G., you might want to check out these places where the locals go. They're tasty, affordable and blissfully glitterati-free.",TRAVEL
"Democrats are questioning the eligibility of progressive underdog Abdul El-Sayed, who would be the first Muslim state leader in the U.S.",POLITICS
"Cities, counties and states all have public golf courses, tennis courts, parks, and beaches for the clothed public. Where are all the topless and nude beaches?  Here are 10 beaches I would love to see with portions set aside for topless and nude sunbathing.",TRAVEL
Jack Morris appeared to make fun of an Asian accent as he discussed Angels all-star Shohei Ohtani.,SPORTS
This is the place to catch an avant garde concert in a deconsecrated church or see an installation in a shelled-out 17th century rococo palazzo.,TRAVEL
"Austin's strange mixture of cultures and ideologies, at what I'll call its early stages, plays out in funny ways.",TRAVEL
"It's a scene right out of Lawrence of Arabia: enormous mountains of sand -- some as tall as 300 feet -- their surface sculpted into soft, geometric designs by the wind, and  extending as far as the eye can see.",TRAVEL
"When top-quality bath and beauty amenities are offered, travelers can leave their TSA-friendly bottles at home or take souvenir toiletries to go. Hotels, happily, have taken notice.",TRAVEL
Do you love the idea of fixing up a Victorian with a wraparound porch or a sprawling midcentury ranch with original features,HOME & LIVING
"""Here we go Patriots, here we go!""",SPORTS
NEW YORK (CBSNewYork) — Alex Rodriguez is going to call it quits after his contract ends.,SPORTS
"Anything you can do, Mirai can do bleeding.",SPORTS
It’s easier than you think.,HOME & LIVING
"Many hotels have on-site bars, even if they're merely situated in the glorified outskirts of the lobby, where guests can",TRAVEL
"The owner who chose the team's controversial name was for 24 years considered ""the leading racist in the NFL.""",SPORTS
It was only a matter of time. Adjustable-rate mortgages--the apocalyptical financial product of the recent economic collapse--are coming back in a big way.,HOME & LIVING
"Mark May 8 on your calendar: The 2014 NFL Draft will be the last time Johnny Manziel finds himself overlooked by the NFL. The former Heisman Trophy winner, drafted 22nd overall from Texas A&M, is a can't-miss superstar who will make every team that passed him over in 2013 rife with regret.",SPORTS
The Zurich Chess Challenge was a festive six-grandmaster extravaganza played this month in the posh Savoy hotel. The American grandmaster Hikaru Nakamura benefitted from the last-minute change in the rules and blitzed his way to win the title.,SPORTS
"Have something to say? Check out HuffPost Home on Twitter, Facebook, Pinterest, Tumblr and Instagram. Going with rope is",HOME & LIVING
"Soweto is overcrowded, dirty and noisy. It's also one of the most fascinating, joyful, high-spirited places I've ever visited.",TRAVEL
"With BC expecting a punt, Villanova wide receiver Jamal Abdur-Rahman received the snap just a few yards off the line of scrimmage",SPORTS
"Anderson Cooper Pets on #AndersonLive is pretty much the best thing ever. Jessica Alba Fair warning, her ""Packaging"" pins",HOME & LIVING
That didn't take long.,SPORTS
Max Scherzer lost a perfect game with two outs in the 9th inning. A former pitcher with the same experience explains how it feels 30 years later.,SPORTS
They are FANS.,SPORTS
i'll need to re-add the links http://archive.org/details/g4tv.com-video11169 Remember 'The Man Show'? It aired on Comedy,HOME & LIVING
"Continuing our visits on the trail of weird places in Florida, as we were driving down the west coast alongside the Gulf of Mexico, we discovered a small quiet park tucked away from the main roads and hidden from the touristic tracks.",TRAVEL
"In honor of Vail's 50th anniversary, we asked Morrie Shepard, the original director of the Vail Ski School, to recall the destination's beginnings.",TRAVEL
"Is Turkey collaborating with the Islamic State (ISIS)? Allegations range from military cooperation and weapons transfers to logistical support, financial assistance, and the provision of medical services.",POLITICS
Indiana's Goshen High School became the latest to ditch the controversial mascot last week.,SPORTS
This superfan gets a million points for creativity.,HOME & LIVING
"Downton Abbey is set in the early 20th century, a time when beauty and bath products were made with essential oils and natural ingredients. At bath time, turn back the clock in favor of products that are toxin-free, sustainability-focused, and made without toxins such as Diethanolamine (DEA), sulfates and other synthetic ingredients.",HOME & LIVING
"“Republicans can’t win a fair fight and they know it,"" responded DNC Chair Jaime Harrison.",POLITICS
"4 Orange County, CA -21% Even small differences in home-price appreciation have large effects on the average monthly cost",HOME & LIVING
"Officials said they had not finalized when or where the meeting would take place, who would be invited, or in some cases whom to call for answers.",POLITICS
"Listen and learn! And if you can't follow along, then you may be a plastic paddy.",TRAVEL
The Huffington Post is proud to present a story originally published by Ecofabulous. Though they look like relics from a,HOME & LIVING
There's a Samsung 4K TV deal you can snag before Black Friday.,HOME & LIVING
"When I hear of black and Latino men being stopped, being searched, being harassed, being beaten, being shot, being killed, I never think, well, this has nothing to do with race. The very idea that somehow, of all areas of life, this is the one where race does not enter, makes me shake with anger. It's always about race.",POLITICS
The state had been banned from hosting NCAA games for nearly 15 years because of the controversial flag.,POLITICS
"It's true you've changed over the years, although people hear your name and still think you're as plain as the potatoes that used to cover your fields. They stereotype you for being the first planned suburb. I know you're more than that.",TRAVEL
The 17-year-old snowboarder tweeted mid-competition about her unfinished breakfast sandwich.,SPORTS
A parting shot at Alex Rodriguez.,SPORTS
"No solariums, greenhouses or even green thumbs needed.",HOME & LIVING
"RELATED: The 50 Most Badass College Basketball Teams of All Time To be specific, he yelled, ""He touched the ball."" He animatedly",SPORTS
"The ""Veep"" star and supporter of Christine Blasey Ford clarified for Time that her “default position is to believe victims.”",POLITICS
Look a little closer.,SPORTS
Analysis shows higher turnout in two urban minority majority counties could have kept Michigan and Wisconsin blue.,POLITICS
The former House speaker has not endorsed in 2016. But behind the scenes he has been lobbying GOP insiders hard to Make America,POLITICS
"By Chris O'Regan, Amateur Titanic enthusiast from Brisbane 4. Captain Smith could have responded to the numerous ice warnings",TRAVEL
"He also tweeted that the move was ""weak.""",SPORTS
Remember when people thought this guy might become president?,SPORTS
The cool weather is finally upon us and before you know it fall will be in full effect. And that means transitioning your,HOME & LIVING
The origin of both the tradition and 2017's tree.,TRAVEL
"Candles don't have to be boring, you know.",HOME & LIVING
"The New York Jets return home on Sunday, flying high off of their 20-7 victory of the Indianapolis Colts. The Jets are feeling good with their season starting off at 2-0, and they play host to a reeling Philadelphia Eagles team that has begun the year at 0-2.",SPORTS
'They probably think their chances of getting sex are higher because their partner will be happy with them and more inclined,HOME & LIVING
"American, a unit of AMR Corp, said its systems were restored as of 3:30 pm CDT (2030 GMT). ""Flights have resumed, but we",TRAVEL
The fate of any legislation to rewrite Obamacare is uncertain.,POLITICS
"You might be tempted to spend the summer grilling in your backyard, but when there are so many different kinds of smoked meats to try from sea to shining sea, why not explore all of the true BBQ that America has to offer?",TRAVEL
"The prestigious Forbes Travel Guide Star Award Winners (which recognizes exceptional hotels, restaurants and spas all over the world) are out, and according to Forbes editors this is the biggest list to date (it also includes Forbes Travel Guide recommendations in various cities). These hotels, restaurant and spas don't bear a star, but they provide guests with a strong sense of location, whether through style or function.",TRAVEL
"An astronaut, a paleontologist and a blonde were riding bikes around New York City: it sounds the familiar set-up for a classic joke. On Sunday, however, as I pedaled around Manhattan with the Explorers Club -- a historic society of adventure and science enthusiasts -- I couldn't come up with a punch line.",TRAVEL
Here's what you need to know about the link between interior wall colors and home value.,HOME & LIVING
"Fifteen years ago the hawksbill sea turtle in my hands would have been hog-tied, whisked hundreds of miles, slaughtered and carved into trinkets. Today, it swam free.",TRAVEL
The answer says as much about the state of American politics as it does about Sanders.,POLITICS
"For five great flat screen TV mounts on the market right now, flip through the slideshow below: Dimensions and weight. Simple",HOME & LIVING
"We asked people from around the world to show us what their community defines as ""play.""  No athletes allowed.",TRAVEL
But there's literally no other way to measure what the public thinks.,POLITICS
"In the plethora of diets out there, no nutritionist has ever said that veggies are bad for you. Eat seasonal ones that are",TRAVEL
The party could be especially weak if Donald Trump wins the nomination.,POLITICS
This week's Moment of Travel Zen comes to us from Lynda Hanwella. Her photo of Gaudi's Sagrada Familia depicts the remarkable,TRAVEL
“They are attempting to legislate hate and discrimination and frankly keep America majority white.”,POLITICS
We won't even try to deny how much better our lives are with the invention of the dishwashing machine. Think of how much,HOME & LIVING
"Wedding season is almost upon us, and we're here to help you step down the aisle in style. You've already set the date, and",HOME & LIVING
We can't think of anything more charming than a rustic farmhouse amidst wild olive and almond trees. Combine that with breathtaking,HOME & LIVING
"A new booking site from TripAdvisor launches Wednesday, promising users an instant refund of the price difference if the",TRAVEL
"The message these elections have hammered home, and here the ""context"" does matter, is the apparent lack of willingness on the part of these groups to continue to live together.",HOME & LIVING
"What if you want to explore other cultures and places but can't hop around the globe like Indiana Jones? Well, if you have space in your yard, then SkyMall has everything that you need to bring the world to you.",TRAVEL
"“I’m unwilling to take no for an answer, I’m gonna make it law by executive order.""",POLITICS
"Africa's elephants face an unprecedented poaching siege. It's a crisis of global significance that the U.S. government is taking action against -- and one in which safari ecotourism plays an important role, undergirding the value for local communities of keeping elephants alive.",TRAVEL
"""We know they are going to keep battling. But we were in good position,"" Nationals manager Davey Johnson told reporters after",SPORTS
Simple changes like creating a buffet table or arranging the seats beforehand can do wonders for making your party feel like,HOME & LIVING
"Jill Stein is hoping to attract disillusioned Sanders supporters, but she has a tough road ahead.",POLITICS
"""I'm not really into sports, man.""",SPORTS
"The Knicks didn't make a horrible move, despite what you might have heard.",SPORTS
Make baseball great again.,SPORTS
The Jamaican may be the greatest sprinter of all time.,SPORTS
"Qatar is aspiring to be the hub that spokes to the world, with its vast investments, its satellite television network, Al Jazeera, among the most watched in the world, and its global philanthropy.",TRAVEL
"Taking an extended journey around the world changes one's life for the better. Travel forces you to become social and adaptable. One has no choice but to walk up to strangers, talk to people and make new friends while on the road.",TRAVEL
"Students often get only a superficial view of the atrocity that built the country, a new study finds.",POLITICS
"Outside Moab, Utah sit a string of spires known as the Fisher Towers. Beautiful in their own right, they're even more memorable",TRAVEL
"""They're so inspiring and so confident.""",SPORTS
"How to manage it all and still enjoy ""the reason for the season.""",HOME & LIVING
