short_description,category
Because nothing screams personality like a generic Ikea model.,HOME & LIVING
"A quick summer getaway should NOT be expensive, and flights are often the most costly part of a trip. So why not plan a summer",TRAVEL
Imagine that eerily quiet Thanksgiving Day feeling that happens for one day in America -- but if it lasted for an entire month.,TRAVEL
A template for beat writers.,SPORTS
Edward Lobrano Interior Design Wells & Fox Architectural Interiors Elle Decor Designer Visions Browse more dining rooms on,HOME & LIVING
-- By Caroline Costello You Might Also Like: Five Types of People to Avoid on Planes Nine Tips for Surviving the Middle Seat,TRAVEL
"""[O]vernight cast member here. Please PLEASE leave your cremated loved ones at home. stop dumping them in Haunted Mansion",TRAVEL
Her failure as first lady made success possible 12 years later.,POLITICS
"Who actually likes airplane food? Whatever they're eating looks real crummy, but hey, at least these folks are happy. Unless",TRAVEL
"Recently, several St. Louis Rams players protested the Ferguson non-indictment, pantomiming ""hands up, don't shoot"" as they came on the field. But in the '60s, the intersection of sports, politics and religion reached its zenith in the person of Muhammad Ali.",SPORTS
"The Crimson Tide defeated the Georgia Bulldogs, 26-23, in overtime.",SPORTS
"It's coming up on Father's Day, and once again, we're here to make your gift-giving experience go as smoothly as possible. How, you ask? By providing a range of perfect hotel experiences to suit all dad types!",TRAVEL
"You might be going on vacation this Presidents Day weekend, but not the kinds of vacations that President Obama, Prince Charles, and other world leaders take.",TRAVEL
Figuring out where to put everyone can be a buzz kill.,HOME & LIVING
"And no, it’s not because it will keep the dog entertained.",HOME & LIVING
"In 2005, the FAA released a statement about mandating the use of car seats in purchased seats on planes for children under two.",TRAVEL
A fight over immigration ended up tanking the farm bill.,POLITICS
He sees nothing wrong with his meeting with the Russian lawyer.,POLITICS
"While finding a fun, kid-friendly vibe on New Year's Eve can sometimes be a challenge, many hotels and resorts are offering special family-friendly celebrations complete with kids' menus and bedtime-friendly celebrations.",TRAVEL
"Our favorite romantic movies and novels have the ability to whisk us away to these magical lands where two people just can't bear to be without one another. You ask yourself ""where in the world are these love-provoking locations and how do I get there?""",TRAVEL
What to do for 15 minutes a week.,HOME & LIVING
"This week the world saw the power of a single image -- that of the lifeless body of three year-old Aylan Kurdi lying face-down in the sand on a Turkish beach. The boy drowned, along with his brother and mother, trying to reach Europe from Syria. The heartbreaking image crystallized the growing refugee crisis, and personified the more than 2,600 people who have died this year trying to reach Europe by sea. Many are coming from Syria, where civil war has killed over 250,000 and displaced 11 million. As debate raged in the media about running the horrific photo, there was no argument about whether Europe and the rest of the West could be doing more to alleviate the horrific suffering. Already David Cameron has announced the U.K. will take in more refugees. But the image was a moral challenge to us all. As a tribute in an Australian paper read: ""Rest in peace Aylan Kurdi. May God forgive us for failing you.""",POLITICS
"With tongue securely in cheek, seat up and tray table securely fastened (or was that the seat belt?), I would like to share some tips to make your travels better.",TRAVEL
But this press conference looks a bit different.,SPORTS
Screw the sabermetrics.,SPORTS
Rafael Nadal suffered his first round-one exit at the Australian Open as Fernando Verdasco recorded a stunning five-set win,SPORTS
"The company's ""2013 North American Airline Satisfaction Study,"" released earlier this week, ranks each of North America's",TRAVEL
"The change of seasons and the stack of new, fresh catalogs that it brings into my mailbox never fails to inspire me. At holiday",HOME & LIVING
"Just another afternoon on my solo four-day lodge-to-lodge cross country ski trek in Washington's Methow Valley, almost four hours from Seattle but a world's away.",TRAVEL
"New Mexico may not receive the same attention as its neighboring states of Colorado or Utah, but the Land of Enchantment has its fair share of great skiing.",TRAVEL
"She knows how many Americans remain wary of big changes, and is betting she can guide them there.",POLITICS
"Don't Get Caught Up In The Thread Count Hype. While most people think that the higher the thread count, the more decadent",HOME & LIVING
"""He was a lot better than I thought he was,"" Mayweather said.",SPORTS
While a lawsuit proceeds.,POLITICS
They also told him there was evidence the pair had been self-radicalized.,POLITICS
Her attorney hopes the media will respect her privacy.,SPORTS
"Defending Roger Ailes, the GOP candidate gave the saddest response to the sexual harassment scandal the former Fox News CEO is facing.",POLITICS
"Meanwhile, a Republican-friendly county has had no problem doing it.",POLITICS
Can you accept an airline upgrade only for yourself while traveling with a romantic partner? Read more on www.slate.com,TRAVEL
"No, we haven't yet celebrated Christmas, but it's that time of year again: The season when holidays tend to creep up on us",TRAVEL
The massacre there was just weeks ago.,POLITICS
Attitudes about gender have changed a lot in the past 80 years.,POLITICS
"Please meet Angie Hranowsky. Recently, editor Sarah Storms got an inside look at the interior designer's Charleston Single House in South Carolina -- a family-friendly abode infused with vintage finds and vibrant hues. The best part of the transformation: the house is a rental!",HOME & LIVING
"Some drugs aren’t banned because they enhance performance — but if certain athletes are using them, they’re suspect.",SPORTS
"Whether it's the people, the culture, the scenery or some combination of all of the above, there is something about the country that compels you to want to explore more.",TRAVEL
Some partisan support from the commander in chief.,SPORTS
"Local officials plan to cash in on a Maya goddess' presence on Isla Mujeres by branding the island as a wonderful spot to get married, enjoy a honeymoon, celebrate anniversaries and otherwise bask in the romantic aura of this part of Mexico.",TRAVEL
"Rules are rules, unfortunately.",SPORTS
Organic gardening practices are gaining popularity as more people realize the benefits. Your plants will be healthier and,HOME & LIVING
Mattis faces a legal challenge if he accepts the job.,POLITICS
Houzz.com Best for: Getting inspired to make changes big (overhauled kitchen) to small (paint color ideas) -- and seeing,HOME & LIVING
"And, be sure to check out our other great crafts in our Craft Of The Day slideshow below. The best part: You won't ever have",HOME & LIVING
Proposed cuts would hamstring research at federal agencies that have a long history of doing the heavy lifting.,POLITICS
"On Saturday, they will be marching against the highly securitized environments that they say exacerbate the school-to-prison pipeline.",POLITICS
"The GOP nominee will probably still win the state, but his numbers have taken a nosedive.",POLITICS
The tidying expert is launching an online course to help people defeat clutter as they spend more time at home.,HOME & LIVING
"According to the U.S. Geological Survey, that ""little tremor"" was a magnitude 5.1 earthquake that occurred at 9:09 p.m. PT",SPORTS
Fatma Samba Diouf Samoura is FIFA's new Secretary General.,SPORTS
It's not just that polls got it wrong. It's how wrong they were.,POLITICS
Trump should set aside his tweets for a few days and take over control of his administration’s actions.,POLITICS
"The world's first Nobu Hotel opened its doors to visitors Monday in Las Vegas. Owned as a partnership by Robert De Niro, Chef",TRAVEL
"If you want to drop a beat, or just pick up the vibes left behind by some of your favorite musicians, check out these rock-ready hotels.",TRAVEL
"“I lived through Watergate,” he said. “It was a scary time.""",POLITICS
"Puzzle Salt and Pepper Shakers We can definitely see these ""fitting in"" in our homes. Trunks Full Of Taste Shaker Set Elephants",HOME & LIVING
"Chad Kroeger and JT Parr, the ""activists"" behind the comedy account Chad Goes Deep, could not get people in Huntington Beach to mask up.",HOME & LIVING
"The Cinematheque Francaise was the brain child of Henri Langlois. Along with Andre Bazin's Cahiers du Cinema, it became the",TRAVEL
"Both all-inclusive Paradisus resorts in the Dominican Republic offer a combined 18 restaurants, but none as fashionable and trendy as Chef Martín Berasategui's.",TRAVEL
"Thanks for nothing, Tom Brady!",SPORTS
"By Sean Martin, Golfweek SAN DIEGO – Torrey Pines may be Tiger Woods’ territory, but he hasn’t won here since 2008. His performance",SPORTS
"While a woman on the street wearing a scarf is treated differently, that doesn't mean she isn't fashion-conscious. One woman",TRAVEL
"New year, new home, in just a few easy steps.",HOME & LIVING
Retired Navy Adm. James Stavridis says sleep is a key strategy.,POLITICS
"As wicked winter weather moves over the Midwest this week, naturally a slew of airline passengers have found themselves faced",TRAVEL
“Would anyone be surprised?” Rep. Dana Rohrabacher (R-Calif.) guessed amid early news coverage of the shooting.,POLITICS
Which is true. The red accents in the kitchen and the mint-green chair and vases in the guest bedroom definitely add warmth,HOME & LIVING
"Fortunately, locals are working to preserve even the most esoteric historical gems. Hidden City Philadelphia runs occasional",TRAVEL
"Zing! But also, accurate.",SPORTS
"My father gave my mother a sense of independence, but when he passed on, she realized that she didn't know how to do the",HOME & LIVING
"You've probably noticed that pie pans, muffins tins, and other bakeware don't nest well -- and that no one likes taking everything",HOME & LIVING
"Saturday night's showdown featured some false and misleading claims from Clinton, Sanders and O'Malley.",POLITICS
You'll be glad you started early.,HOME & LIVING
4. Put a small desk in front of a huge leaning mirror for an instant vanity. Contemporary Bedroom by Atlanta Architects & Designers,HOME & LIVING
Trump turns DACA dreams into nightmares.,POLITICS
"Texas A&M quarterback Johnny Manziel made the 11th-ranked Oklahoma Sooners look like a high school team. He dazzled, danced and scrambled in the pocket as if he were playing 7-7 pickup football in the summer.",SPORTS
"Originally published in The Boston Globe. At the White House, protecting America from its president is a full-time job The",POLITICS
"We need much more humane tactics in dealing not only with unarmed, young men, particularly those of color; we also need much more humane tactics in dealing with the mentally ill.",POLITICS
"Welcome back to the White House, Blackhawks.",POLITICS
"Sure, the bill is bipartisan. But it doesn't do much.",POLITICS
"My mission this trip was to boldly go -- well, a bit further east (and not just on the way to the airport).",TRAVEL
"GET READY, GET SET, BID!!! Want to add some fab eco-friendly style to your home but have no time to page through thousands",HOME & LIVING
Dezeen Magazine: The design-savvy people behind this London-based architecture magazine have pinned some seriously inspiring,HOME & LIVING
The rock band Boston also followed suit.,POLITICS
Tyler Sash died at 27.,SPORTS
"""They don't get any backlash, not on the level that we're getting.""",POLITICS
No shutdown avoided today.,POLITICS
Both Woody Allen and William Shakespeare have words of wisdom regarding the momentous flight today of Qantas Airlines' newly resurrected Airbus A380. Don't believe me? Keep reading.,TRAVEL
A couple of years ago I ran across an inexpensive gadget that enables you to get tough on the grime while limiting the damage to your fingers: a beautifully designed ridged washboard small enough to fit into your toiletries bag.,TRAVEL
"Sometimes it takes a while to realize our true calling. That was the case with Allison Bloom, a mother of three from Mill",HOME & LIVING
It's not just about the game.,SPORTS
"Welcome to the HuffPost Rise Morning Newsbrief, a short wrap-up of the news to help you start your day.",POLITICS
Live results for the 2016 South Carolina Democratic Primary.,POLITICS
Also poverty is down and more people have insurance. Maybe dial back that doom and gloom?,POLITICS
A David Attenborough docuseries and Netflix adaptation of Leigh Bardugo’s “Grishaverse” series top the platform's rankings.,HOME & LIVING
What You'll Need Wool felt Cotton ribbon Bead Trim Twill tape Button Thread Shoestring elastic How To Make It 1. Make a cursive,HOME & LIVING
"With the court's move, both student athletes and the NCAA lost a bid in this fight.",POLITICS
"My annual pilgrimage to the Stratford Shakespeare Festival stimulated the thought once again about what it's like to be in a community that devotes itself to beauty. That beauty matters in a town of Stratford's size and geography is not only unusual these days, but it summons a reflection about what beauty entails and why it is important for our lives.",TRAVEL
"We've come across a good number of unique tables, but this beautiful piece by CustomMade artisan Fred Brandes caught our",HOME & LIVING
A Trip to Yellowstone A: Yellowstone (and nearby Grand Teton National Park and Jackson Hole) should be on everyone's bucket,TRAVEL
"Ideology, nepotism and, above all, unpredictability.",POLITICS
We can think of some better uses for those old socks you have lying around. Flickr photo by George Eastman House CELL PHONE,HOME & LIVING
Congrats to this wonder woman.,SPORTS
The Navy’s plans threaten an area of the Gulf that couldn’t be more biologically sensitive.,POLITICS
"​""As the South African Police Service, we do not have a report based on those allegations. We only heard over the radio that",SPORTS
My recent adventure to Oxnard further fuels my desire to find hidden gems in and around California.,TRAVEL
"Long-term traveling can teach you more than almost anything else. About yourself, about life, about what you need to be happy. It's too easy to get complacent at home and if you aren't at least a little uncomfortable, you probably aren't learning anything.",TRAVEL
"Now that you've survived the dreaded Thanksgiving travel weekend, it's time to start preparing for the next busiest period: year-end travel.",TRAVEL
Let's talk about messiness. What's your threshold for disorder? Just how many socks can pile up on the floor before you reach,HOME & LIVING
"Tessa Virtue and Scott Moir now have more Olympic medals than any other figure skaters, ever.",SPORTS
"We know that with the weather getting nicer, you're probably not dying to spend your weekends doing household projects. (Neither",HOME & LIVING
"House Republicans want to convert Medicare into a voucher program, and would like to see the Senate concur. All this ties together as the biggest threat to health care for seniors and the disabled that we have yet seen. Democrats need to discover their spine!",POLITICS
"""Miniature soccer team on the way,"" she said after announcing the news.",SPORTS
Mediterranean Bathroom by Austin Architects & Designers Vanguard Studio Inc. Contemporary Bathroom by Denver Interior Designers,HOME & LIVING
"""MAKE BASEBALL FUN AGAIN.""",SPORTS
A new Christmas sequel tops the list.,HOME & LIVING
A new poll finds people are half as likely to have heard about corporate share buybacks as bonuses for workers.,POLITICS
"Like smokers trying to quit a pack-a-day habit, some journalists are finally trying to drop the long-running practice of",POLITICS
"The route that takes that honor is the trip between Westray and Papa Westray in Scotland's Orkney Islands, which can take",TRAVEL
"Americans naturally think Europeans are more sophisticated when it comes to sunbathing ""au naturel."" The reality is, however, that the U.S. has some of nicest, most popular, well managed, and friendliest nude sunbathing resorts in the world.",TRAVEL
The five-time All-NBA player discusses how point guards and big men have reversed roles.,SPORTS
"Amid an inquiry into a wiped election server, Georgia's chief election official said there is no evidence to support the suggestion.",POLITICS
"To both the seasoned and occasional traveler, getting the best value in an airfare is the elusive dream that is difficult to consistently achieve. There are, however, some time-proven practices that travelers can implement to help reduce the cost of air travel.",TRAVEL
"Living and working in London but harboring fantasies about country life, Niall Maxwell, the founding principal of Rural Office",HOME & LIVING
It was the 27th match between the two sisters.,SPORTS
"Michael Jordan turned 50 today, and while His Airness has been out of the game for a while, we're still looking for his replacement",SPORTS
"Americans love Eurail passes and for a good reason: They're convenient and exciting to hold onto before your trip. They are not necessarily, however, a great deal.",TRAVEL
"I hadn't been in Santiago for a while. Now that I'm back, however, the truth is I'm not filled with the same apathy I was when I left three months ago to gallivant around Patagonia .",TRAVEL
"Just a friendly reminder from your local TSA agent that you can't bring these on a plane. The TSA, which is wont to highlight",TRAVEL
Do you have a home story idea or tip? Email us at homesubmissions@huffingtonpost.com. (PR pitches sent to this address will,HOME & LIVING
"Welcome to the HuffPost Rise Morning Newsbrief, a short wrap-up of the news to help you start your day.",POLITICS
Sad news after a scary play.,SPORTS
Husain Abdullah's words come just two weeks after the NFL admitted a link between head trauma and CTE.,SPORTS
Independent investigators are scrutinizing the institutions that survivors and their families say knew about his abuse but tried to cover it up.,SPORTS
This year you should stop putting that trip on hold. It is possible to go on a vacation staring a design or luxury hotel if you happen to know the right places.,TRAVEL
"As a predominant design element, wallpaper is definitively back, but quite literally this isn't your grandmother's decor. Gone are the frilly florals and chintzy damasks.",HOME & LIVING
We predict that Russia will continue to recognize the separatist cities and do everything in its power to make it difficult for the Ukraine to be an active participate in the European Union by raising gas prices.,POLITICS
Just imagine what he'll be doing at age 80.,SPORTS
"PHOTO: Recently, there was speculation that another music diva was looking to purchase Cher's Malibu digs -- Beyoncé. Perez",HOME & LIVING
"If you need to get away -- far, far away -- to a magical place completely different from anything you're used to, visit Sumba",TRAVEL
Curry had a jaw-dropping seven threes in the first period alone.,SPORTS
"With Memorial Day fast-approaching, you may be scavenging for last minute decoration ideas to make your backyard barbecue",HOME & LIVING
"Booking a stay in a standard, chain hotel is the easiest way to plan a vacation. A brand name assures us that our room will",HOME & LIVING
Editor's Note: Some of the lyrics may be offensive to some listeners. Check out the routine above. Do you think mid-air flash,TRAVEL
"And with that, he also called for making two-year community colleges free.",POLITICS
Do you have a home story idea or tip? Email us at homesubmissions@huffingtonpost.com. (PR pitches sent to this address will,HOME & LIVING
The controversial organization must strike while the superstar is still hot.,SPORTS
"The instant Stephens posted his murderous video, he assured himself notoriety beyond his wildest dreams.",POLITICS
"On July 11, 2014, a few hours after LeBron James revealed in a Sports Illustrated letter that he was ""coming home"" to the",SPORTS
It will be the first time the San Francisco 49ers quarterback has played all season.,SPORTS
Our dreams are finally coming true!,HOME & LIVING
If you like it then you can put a monogram on it.,HOME & LIVING
"If you would like to see the house for yourself, send a Facebook message to Lights On Ice Crystal for the exact location",HOME & LIVING
"Just off the coast of Mexico, within sight of crowded Cancun but a 20 minute ferry ride across the blue Caribbean, lies Isla Mujeres, a tiny coral island that is one of Mexico's true treasures. Isla is no tourist haven.",TRAVEL
"Move over, kiss cam. There's a new schtick in town.",SPORTS
This documentary once stopped the entire nation.,HOME & LIVING
The home is definitely not what you'd think it would be.,HOME & LIVING
"Answer: Reality. Answer: Reality. You come across a beautiful photo on the Internet -- one with vibrant colors, the perfect",TRAVEL
"This story was originally published on Ecofabulous. Based in Brooklyn, Re-Baroque is now sold on the West Coast at San Francisco’s",HOME & LIVING
"Whether wrapped in Egyptian cottons or not, everyone casts a shadow. Being reminded of that fact ought not to ruin anyone's vacation.",TRAVEL
"As an American, a Jew and a proud trade unionist, the actions of a small minority in Local 2865 are very disheartening. In the course of the last ten years, I have participated in numerous labor delegations to Israel hosted by the American Friends of the Yitzhak Rabin Center.",POLITICS
"I've written previously about a number of fascinating innovations in the airport sector, whether it's robotic baggage handlers",TRAVEL
"Stern, who served 30 years as the NBA’s longest-tenured commissioner, is undergoing emergency surgery.",SPORTS
"Progressives should be encouraged by recent special election results, not looking for a scapegoat.",POLITICS
"It goes without saying that we look to everything, from flowers to table settings, as color inspiration for our homes. But",HOME & LIVING
"Not that I'm not romantic, but I think Valentine's Day is a little cheesy. I mean, it is. But I believe in love. And shopping!",HOME & LIVING
The tribute came six months after the deadliest mass shooting in modern U.S. history.,SPORTS
"Although news headlines often glibly refer to a ""war on women"" in political terms, policymakers might well devote more energy to sex trafficking -- a nightmarish war faced by the most vulnerable among us, young women who are being bought and sold for sex against their will.",POLITICS
"Altogether now, will the far left play into Steve Bannon’s hands?",POLITICS
"I realize that many factors play a role in the examples I cite above, including the judicial system itself; official versus real life police attitudes, not to mention the law and recent questionable policing techniques implemented in New York City and elsewhere.",POLITICS
"""You heard me, curling Fool!""",SPORTS
"The suite life? Depending on where they're going, Phelan said, the Giants reserve up to 200 rooms in a hotel, with enough",TRAVEL
Add wallpaper to the latest trend of all-things-ombre. What initially looks like a cleverly painted ombre wall turns out,HOME & LIVING
"My husband and I have been to many warm destinations when the New York temps start to threaten frostbite. We've done the typical: Miami, California. We've done the cultural: Argentina, Brazil, Chile. But we had yet to do the tropical.",TRAVEL
In case you weren't already pumped.,SPORTS
"There have been growing pains as the NFL tries to implement the rule. But with the league on the right track, it’s not time to slow down.",SPORTS
"Stop the foolishness and talk to us like grownups. There will be no ""trade war"" if we pursue a currency chapter in the TPP. There will be a lot of arguing and negotiating about what technically constitutes currency manipulation to gain an edge in trade. It could blow up the deal, and Secretary Lew, Rep. Ryan, and others should explain to us and to members of Congress why that's a more costly outcome to American workers and businesses than continuing to live with labor demand-draining trade deficits. If they can do so, then let's have a TPP. If they can neither make a convincing case based on facts, not war-mongering and fear tactics, nor can they offer a convincing alternative for legislative actions outside of the TPP against currency manipulation, then they must either negotiate a currency chapter or accept defeat.",POLITICS
Check out the nine weirdest toilets we've ever seen: But a tiger in the bathroom is far from the strangest thing we've ever,HOME & LIVING
The Cleveland Browns quarterback was accused of sexual misconduct by two dozen women while he played for the Houston Texans.,SPORTS
"Whether on a small-boat tour, or even closer to the water in a kayak, when exploring desolate little bays and inlets, sea lions are a constant presence.",TRAVEL
"The staunch Trump ally previously downplayed the threat of the coronavirus pandemic, accusing the media of ""playing up fears.""",POLITICS
"The neurodegenerative disease has been linked to depression, memory loss and dementia.",SPORTS
"Once you see who designed this space, you won't be surprised by the whimsical vibe.",HOME & LIVING
"He's in the market for a new place, but how can you really top this?",HOME & LIVING
Dream on while tasting the rainbow.,SPORTS
"""What matters here is winning and losing, first and foremost,"" the New Jersey governor says.",POLITICS
