short_description,category
"Twain once remarked that stepping aboard an authentic steamboat, you enter ""a new and marvelous world."" If you haven't had that experience, you might want to put the American Queen on your bucket list.",TRAVEL
"As one of the most diverse and culturally wealthy countries in the whole of South America, Peru is one of those destinations that offers so much to visitors. But where, what and how do you get the very best of it?",TRAVEL
(H/T to The Big Lead) Perhaps the sideline scuffle sparked something for the Wildcats as they bounced back scoring 21 straight,SPORTS
"For Affinia hotels, a pet psychic service may be a shtick to prove its pet-friendliness, bBut our interview showed us that those who believe in Dr. Ferguson's abilities seem to get real insight and comfort from her pet communications.",TRAVEL
Marquise Goodwin caught a long touchdown pass in a game hours after his newborn son died.,SPORTS
Charles McCool acquired his travel smarts the old fashioned way: he picked it up on the road. All of his trips were self,TRAVEL
"There are many, they smell divine and they make traditional Italian dishes almost intoxicating. How do Italians use them",TRAVEL
Irish women will no longer have to travel to the United Kingdom to end their pregnancies.,POLITICS
Never shave the weird beard.,SPORTS
"It was just a little over two years ago that The Garagiste Festival was a mere gleam in the eyes of co-founders. This November 7 - 10th, the Festival is showcasing the talents of 66 winemakers, all of whom handcraft under 1,200 cases of wine per year.",TRAVEL
"Say it with us: ""How YOU Doin'?""",HOME & LIVING
The Christian Voice attacked British diver Tom Daley online for being gay.,SPORTS
"Whether it features a standard step-in shower or a soaking tub, the bathroom is the one place that should help you feel relaxed",HOME & LIVING
"If you believe in a free and open internet, join us in this protest.",POLITICS
"1. The entire landmass of the Philippines is made up islands, making it the second-largest archipelago in the world. In fact",TRAVEL
"We know you're already sacrificing space, so why skimp on style? These pieces will whip your place into functional shape",HOME & LIVING
"One pilot ejected and was rescued, while the other was able to safely land.",POLITICS
"When it comes to vodka, the Russians don't mess around.",TRAVEL
A newer attraction on the tour routes -- it's only 450 years old -- is a colonial town full of yellow buildings called Izamal.,TRAVEL
We're wondering if even the toilet gets the gilded treatment.,HOME & LIVING
"In an interview with Piers Morgan set to air Sunday, Trump calls the initial U.S. decision to lift a ban on trophy imports “terrible.”",POLITICS
The Jaguars are hosting a very clutch Pokémon Go safari night.,SPORTS
I'm officially declaring 2014 the perfect time to renew our love for outdoor living! Here are five simple things we can do to get started for spring and make an environmental impact.,HOME & LIVING
All you need is a common household item.,HOME & LIVING
How much did his buddies pay him?,SPORTS
"Here, we look at the oldest and the newest Olympic venues in town.",TRAVEL
"5. A little touch of vintage or history goes a long way. Sentimental decor -- think old photos, vintage signs and artwork",HOME & LIVING
"MIAMI — On Dec. 16, 1987, a teenager named Marco Rubio arrived home from school in West Miami to find his mother in anguish",POLITICS
How the Supreme Court and bitter partisanship over Obamacare are letting Red America slip further behind while Blue America moves forward.,POLITICS
Paris may be the art and fashion capital of the world -- known for its over-the-top luxury properties and bohemian boutiques -- but most people can't afford a stay at the iconic Hotel Plaza Athenee.,TRAVEL
- Get friends and other people to comment on your project. Craftfoxes will pick five finalists based on how many comments,HOME & LIVING
"7. Be very careful where you stow your guests. 9. If you find ""The Merv Griffin Show"" set in the trash, it's your duty to",HOME & LIVING
"A Manchester Airport spokesman told The Huffington Post UK: In August 2010, three kids eager to see Dollywood took a Southwest",TRAVEL
"Petroleum Jelly. For patent leather, a little dab of petroleum jelly will make shoes good as new. Simply apply to a cloth",HOME & LIVING
"Her home is also incredibly airy and bright. Although, there is one downside to the space: mosquitoes are frequent visitors",HOME & LIVING
New coach Jim Grobe puts football ahead of campus sexual assault.,SPORTS
For 12 glorious days the people of Minnesota (and all visitors to the state who are most welcome) immerse themselves in all things Fair-related; even those who don't go every year know all about it.,TRAVEL
"From the more under-the-radar beach spots to the mainstays of Rome and Venice, Italy has long been a draw for American visitors",TRAVEL
"It all started because I wanted the Nelson Swag Leg Desk. Not a new, licensed reproduction--I wanted the scuffed-up, 1960",HOME & LIVING
"""It's going to be fun playing the orphans this summer.""",SPORTS
The man was accused of posting anti-trans messages and making violent threats in comments under the dictionary website’s definition for “female.”,POLITICS
"Create an instant bonfire with these versatile fire pits, perfect for the campsite, the patio, the lawn (but not recommended",HOME & LIVING
"""I can do that.""",SPORTS
Starting with this amazing 1940s Italian Tole chandelier.,HOME & LIVING
"7) A washer-dryer. OK, we know this isn't always possible. But even an apartment-sized stack washer-dryer set is better than",HOME & LIVING
The president reached out to Samantha Fuentes while she was in the hospital recovering from shooting wounds.,POLITICS
There's a reason this was such a well-kept secret on Capitol Hill.,POLITICS
"But there is something incredible, something so unexpected, about doing yoga in an airport. It allows you time to stop and breathe in a space that asks for nothing and leaves you craving nothing. And when you're ready, you can go -- go anywhere in the world you'd like.",TRAVEL
The administration had suggested $18 billion of cuts to popular domestic programs.,POLITICS
"One Democratic senator says he should resign from his White House post, another suggests he should lose his security clearance.",POLITICS
"Somewhere near the back of a very large airplane, I had a window seat, flying from Amsterdam to Minneapolis. We had finished the first meal, the second glass of wine. Most of the seatback video screens glowed a new movie.",TRAVEL
"3. Val d'Isère, France What's cool: Though some bemoan this mega resort for being crowded, pricey, and even a bit gauche",TRAVEL
And eleven other wild models that take repurposing to the extreme.,HOME & LIVING
The new requirements likely will cause many Medicaid beneficiaries to be removed from the rolls.,POLITICS
"A new short film, When AIDS Was Funny, unearths never-before-heard audio reaction to the escalating AIDS crisis.",POLITICS
The 17-year-old wins with a near-perfect 98.25 score.,SPORTS
The tennis champ let her fists fly in a cross-training workout with the former heavyweight champ.,SPORTS
"That's precisely why racism holds on within America. In the privacy of our homes, clubs, and offices -- and in the tradeoff of philanthropy and what we perceive as the greater good -- we ignore our values, dismiss and rationalize them.",SPORTS
"I spent 12 magical days in Botswana exploring four camps -- Chitabe, Vumbura Plains, Abu and Mombo -- in various regions of the Okavango Delta. Each had its own personality and exciting wildlife adventure. I started my trip at Chitabe Camp, and now... Vumbura Plains",TRAVEL
"It’s been nearly a year since the U.S. announced support for waiving vaccine patents, but influential countries have yet to release a possible agreement.",POLITICS
"No seriously, what the hell?",SPORTS
The former Stanford standout has all of the tools to become an NFL star.,SPORTS
The tragedy occurred in driveway of his Arizona home.,SPORTS
"Within the last two weeks, much of the African American community has been thrown into abject pain yet again. The police",POLITICS
"From Richmond jerseys to track suits to biscuit-baking essentials, here are the best ""Ted Lasso""-themed gifts.",HOME & LIVING
"Enjoy two minutes with an extra-hot latte on what I think of as ""the Ramblas of Glasgow"": Buchanan Street. But with or without",TRAVEL
Plan ahead.,TRAVEL
Read this for your own emotional well-being.,SPORTS
"""You guys are hilarious. Talk to me more about how millennials need participation trophies.""",POLITICS
"""I guess this goes against every U.S.-Russian stereotype ever,"" Chris Mazdzer said.",SPORTS
"While perusing Pinterest, we came across the work of Berlin-based artist Owen Gatley, whose unique illustration of a home",HOME & LIVING
Game recognize Game.,SPORTS
"Tuberville smacked Oliver upside the head, knocking of his headset and hat faster than you can say ""gif."" (H/T to The Big",SPORTS
"In the old cavernous wine cellar, we whet our appetites sampling wines from a handful of local producers, which we later sipped with a multi-course midday meal.",TRAVEL
"Politics is never divorced from sports, not even when it comes to the construction of stadia. Budgets however have recently thwarted plans in Turkey and Saudi Arabia to build a host of sporting facilities in a bid to either win votes or curry favour with youth and other segments of the population.",SPORTS
"Throughout the event, the collective emotion of the crowd swings like a pendulum, from near mob mentality to sheer silence, and back again, as if following some strict protocol. I try to keep up.",TRAVEL
Some land mines are in the way of the Bucks' hopes for this season.,SPORTS
"Yes, summer vacation is for kicking back and relaxing, but learning doesn't have to be a chore.",TRAVEL
The glimpse of a robin atop a huge snow pile doesn't seem to hold the usual promise that warmer temperatures are close at hand.,TRAVEL
DENVER — Tom Brady and Peyton Manning have a season’s worth of head-to-head matchups in their storied rivalry — 16 previous,SPORTS
"If you're one to honor the emergence of seasonal ingredients, you'll find a cornucopia of food-centric festivals taking place all around the United States, from California to Massachusetts. Here are some of the season's most satiating celebrations.",TRAVEL
"""Attention, all Cleveland Browns fans!""",SPORTS
"I stayed in the new ultra luxurious Ani Villas, perched high on a cliff overlooking Little Bay.  Watch and see why I did want to leave.",TRAVEL
"College football culture is causing hundreds of reported rapes every year, new research indicates.",SPORTS
“It is a very sobering thing to be thinking about oneself as president of the United States.”,POLITICS
And it doesn't even need music to get the party started.,HOME & LIVING
"I have enjoyed a lifelong love affair with baseball. But as passionate as I am about our national pastime, there are some things that need to be changed. Here then is what I hate most about the game I truly Iove.",SPORTS
"Ghost hunting has become big business, with paranormal experts offering as evidence dark shadows and orbs of light caught on film, recordings of strange noises and unexplained temperature drops. Get ready to conjure some spirits at these haunted places.",TRAVEL
Freshman Benjamin Knox was arrested shortly after the incident.,SPORTS
"During my walks through the parks of Beijing I found people amusing themselves and each other in a variety of ways. At one particularly rambunctious square there was a badminton game going on, several people were getting back massages, another little band was performing. All of this activity was decidedly non-goal oriented.",TRAVEL
There are some who say the Democratic Party should stop talking so much about issues affecting women and people of color,POLITICS
"The White House says the order ""will keep the nation safe.""",POLITICS
Many of us aren't lucky enough to have large backyards to grow lush vegetable gardens. But that doesn't mean we can't exercise,HOME & LIVING
"Sky High Holistic ""did not seek nor obtain the consent of any officer to record their communications,"" lawyer says.",POLITICS
The Sling is available at a number of retail locations as well as online. We’ve seen eco-friendly hammocks before (you can,HOME & LIVING
"There’s an obvious trend in Trump’s cabinet picks: billionaires and generals. The billionaires favor private enterprise, capitalism",POLITICS
"On the other side of the net, Djokovic will go into the final with an improved second serve, and that's a huge asset (if",SPORTS
"When I travel to other places in the world, trotting with my camera, I always wish to have at least one or two images of myself that will capture the real essence of the place and myself in it.",TRAVEL
"Flight Attendant We don't mean to state the obvious, but you'll get to fly all over, with perks like a flexible schedule",TRAVEL
"Trump enlisted ""his friends at The National Enquirer,"" Cruz claims.",POLITICS
There are many occasions when a plant's leaf is more intriguing than its flower -- introducing the Copperleaf. The Acalypha,HOME & LIVING
"For me, few things evoke far-away places and exotic locales better than local produce. The bright colors, strange shapes and funky textures are like a physical manifestation of the many miles you've traveled from home. Plus, you can indulge in the native fruits and vegetables of your destination with minimal guilt -- good news for the health conscious traveler.",TRAVEL
"Change a tire: easy you say, whoa, not so fast, some cars are better equipped than others, so the first thing to do is to make sure you have all the proper tools in your vehicle, meaning a trip to an auto care shop.",HOME & LIVING
Photo by Erica Chan Coffman of Honestly WTF Few things feel more glamourous than wearing a sparkly pair of heels. But rather,HOME & LIVING
An insider's guide to what could be the struggle to win a contested convention.,POLITICS
"“Congress must make it extraordinarily difficult, if not impossible, for the Department to spy on the Congress or the news media,” said Rep. Jerrold Nadler.",POLITICS
"The tradition of St. Patrick's Day parades actually originated in America. Instead of getting drunk on Guinness, why not",TRAVEL
What an arm.,SPORTS
"For Jonathon Simmons, dreams really do come true.",SPORTS
Bullying between public servants and private citizens on federal lands is not a one-way street. But you would never know that listening to House Republicans' congressional hearings.,POLITICS
"Growing plants in containers lets you have a garden even when space for one is limited or nonexistent. You can use containers to turn a tiny balcony, patio or roof garden into a leafy haven, filled with patio roses, herbs, even your own fresh vegetables.",HOME & LIVING
Just great. Nearly twelve hours on an airplane to Incheon and six more hours the next day to Phuket with two kids and we'd have to deal with the noise of the nearby construction all night long.,TRAVEL
"If you thought we were going to get overly Autumnal on you - surprise! True, we've housed our fair share of metallic pumpkins",HOME & LIVING
"The remote South Atlantic island of St. Helena is forever linked with the name of Napoleon Bonaparte, the megalomaniacal Corsican-cum-French emperor who was exiled there by the British in 1815.",TRAVEL
Experts are pushing back on Trump's claim about the legal privilege.,POLITICS
He said he wouldn't talk about politics at the Boy Scout event. (Then he did.),POLITICS
What the what?,HOME & LIVING
"By Golfweek Staff, Golfweek On Saturday, Keegan Bradley says that he was heckled by a fan off the 18th green at the end of",SPORTS
The Giants leadoff batter Blanco was issued a free pass to start the first.  A wild pitch advanced him to second and he stole third.  Royals pitcher Jason Vargas walked Buster Posey putting two on in the corners.,SPORTS
"A look at the most-purchased beauty products, kitchen items and electronics on Amazon in 2018.",HOME & LIVING
The football team was on strike.,SPORTS
"Now that Democrats have 34 votes, could they get 41?",POLITICS
"""I'm just happy.""",SPORTS
We would like to thank Mr. Obama for giving us a great eight years.,POLITICS
"The ban would be difficult to enforce and likely violates Roe v. Wade, say its critics.",POLITICS
Finally! 🙌,TRAVEL
His new strategy has Democrats rallying in 40 cities on Sunday.,POLITICS
"Today is a day of transition in the 8th annual around the world travel adventure competition. We are neither here nor there yet, but hovering in a place in between -- also known affectionately as a layover!",TRAVEL
Information on 198 million American voters was freely available -- if you knew where to look.,POLITICS
"When the president goes low, Colin Kaepernick goes high.",SPORTS
"Republicans and private telecoms maintain that cities lack the capacity to build and manage broadband networks. They're empirically wrong. Of the 160 municipally owned broadband networks, the successes vastly outnumber the failures.",POLITICS
Donald Trump Jr.’s email communication and subsequent meeting with a lawyer connected to the Russian government constitute,POLITICS
"Yes, he's looking at you, Sam Bradford.",SPORTS
Learn about the different types of smart light switches that are on the market and everything you need to know to install,HOME & LIVING
AMC's Mad Men featured its usual slew of Los Angeles locations filling in for mid-century New York (and also LA and Detroit,HOME & LIVING
Players and fans winced and looked away.,SPORTS
Gun control is not equivalent to Islamophobia.,POLITICS
"The documentarian reiterated his grief that society has destroyed large swaths of the natural world, but said humanity is “not beyond redemption.”",POLITICS
"Giants say they're ""comfortable"" with the player's recovery from his July 4 fireworks accident.",SPORTS
"El Día de Los Reyes Magos (The Day of the Three Kings) is the most anticipated holiday of the year for Spanish children. Also known as Epiphany, it's celebrated 12 days after Christmas and marks the day Los Reyes Magos, the Three Kings from the East, brought gold and gifts to the newly-born Baby Jesus.",TRAVEL
"Cashmere linings, organic cotton linens, specially-printed drapery, personal art collections -- when fashion designers work with luxury hotels, the end result is an experience worth indulging in.",TRAVEL
He’s the most distrusted Republican candidate in recent history when it comes to policy.,POLITICS
"Giannis Antetokounmpo, take a bow.",SPORTS
Even before Michigan State completed its BCS-altering upset win over Ohio State on Saturday night there was at least one,SPORTS
Darya Klishina is appealing the decision.,SPORTS
"The Trump Organization used the presidency to pressure a foreign head of state, critics say.",POLITICS
The Rays silenced the Houston Astros 4-2 in Game 7 of the ALCS to reach the World Series for just the second time.,SPORTS
"Nearly three decades ago, Howard Kaminsky, of Random House, called on the real-estate developer and self-marketing master",POLITICS
"Accommodations As with the entire ship, the staterooms on the Disney Fantasy are well-appointed and nicely decorated with",TRAVEL
"Shortly after the final was over on July 7, 1974, I took the train from Amsterdam to the German town of Solingen where I was scheduled to play an important international chess tournament.",SPORTS
"Maroney told ""Dateline"" she reported the abuse to John Geddert during the 2011 World Championships, but he did nothing.",SPORTS
You thought those ratty old stockings your mom has been hanging since 1985 were the ultimate throwback to Christmas past,HOME & LIVING
"For a colorful alternative to neutrals, opt for more muted blush tones. Beigy-pinks and peaches are more understated and",HOME & LIVING
"Swap out an existing overhead lighting fixture with a chandelier. It's beautiful, elegant, and best, it's easy to do with",HOME & LIVING
"Catching some sun and sipping on cool drinks are fine activities for the 4th of July. But, it can feel a little boring after",HOME & LIVING
"""You’re actually being a partisan hack,"" Lauren Duca said.",POLITICS
"He's ""openly racist""; she's ""done things illegally.""",SPORTS
He can return to the octagon effective immediately.,SPORTS
"Craigslist's furniture category has really just become an overpriced graveyard for Ikea furniture, where everything is ""vintage."" If you even think about selling, I'd like a word with you.",HOME & LIVING
"Between the endless stream of holiday music, window displays and festive events, the holiday season can sometimes feel like",HOME & LIVING
COME ON.,SPORTS
San Francisco won the 2-1 decision over the Twins and improved to 5-0 in Interleague play this season.  They clinched the three-game series and won six of their last seven games against Minnesota.  The Giants now own the best record in the Majors.,SPORTS
"""In this one instance, Rex Tillerson is all of us.""",POLITICS
"Unless you're willing to hand over your own hard-earned airline miles, diehard travelers can be impossible to shop for: If things are going well, they won't be home enough to enjoy that fancy new juicer.",TRAVEL
"Graham-Cassidy is just as much a wolf as past Republican repeal bills, despite its sheep’s clothing.",POLITICS
Princess Cruise Lines puts a big effort into helping its cruisers be prepared for each port (better than the other lines,TRAVEL
Some post-Thanksgiving projects to tackle.,HOME & LIVING
Tensions were high ahead of the clash of Manchester United and Chelsea. United manager Louis Van Gaal's hand was forced by injury and suspension to again adopt the 4-1-4-1 used against West Bromwich Albion.,SPORTS
He had a criminal record that included arrests for assault and burglary.,POLITICS
"Political betting markets, which tend to be pretty accurate, put the probability at 61 percent.",POLITICS
Although this catch by Reggie Wayne during the second quarter will be rightfully overshadowed by the Colts' comeback that,SPORTS
"Set up a home theater system the whole family can enjoy complete with all of the essentials: surround sound, sub woofers",HOME & LIVING
"VitaminDaily.com's Toronto contributor Kat Tancock spent a whirlwind weekend in Vancouver, and her of-the-minute itinerary is fit for visitors and locals alike.",TRAVEL
The White House chief of staff is tragically ignorant about the history of the country he serves.,POLITICS
Congress could make all companies allow workplace sexual harassment victims to go to court. But the bipartisan legislation seems to have stalled.,POLITICS
The ban on cruise ships sailing too close to the coast in Venice and in nature reserves was imposed after the shipwreck of,TRAVEL
Decorative gourd season is upon us.,TRAVEL
"Because Kajuan is Black and was killed by the police, we instead look for any and every possible way to justify his death.",POLITICS
"Democrats continue to blame President Bush for beginning the war, in the first place, while Republican candidates are attempting to turn the tables by blaming President Obama for abandoning Iraq. In reality, Republicans and Democrats both share responsibility for Iraq's dismal state of affairs.",POLITICS
Q: I will repot the herbs and I was thinking of planting them in a rectangular container because it would fit the window,HOME & LIVING
This puts our bunk bed to shame.,HOME & LIVING
"Watch the video above featuring Miss Throwback herself, our editor Brie Dyas, on HuffPost Live for the rundown. Don't forget",HOME & LIVING
"For even more style inspiration, check our our favorite TV shows. We may not have the ""touch"" when it comes to keeping our",HOME & LIVING
"The comedy special ""Aziz Ansari: Right Now"" debuts.",HOME & LIVING
"The north shore of Maui is the true Hawaii, the Hawaii of every surfer's dreams, of National Geographic photographs, the Hawaii of the imagination",TRAVEL
You can buy just about anything on the internet. Don't believe us? Check out these weird postings we found for this week's,HOME & LIVING
This is his 18th year in the league.,SPORTS
The Afghanistan war now belongs to President Donald Trump. His “path forward” with more troops and fighting will take America,POLITICS
"People who keep llamas as pets will readily offer you any number of reasons: llamas are quiet, they're gentle and affectionate",HOME & LIVING
Is something the matter?,POLITICS
"Lawbreaker. That is exactly what we need to start calling American Airlines for its blatant refusal to proceed with a union election among its 9,600 passenger service agents.",TRAVEL
"The foot pain New Orleans Saints quarterback Drew Brees experienced Monday was likely to be sudden and excruciating, according",SPORTS
The Dab is officially over.,SPORTS
The race is effectively tied in North Carolina and Ohio.,POLITICS
Sunday marked the first time a player nabbed consecutive All-Star MVP honors since Bob Pettit in the 1950's.,SPORTS
Here's the evidence.,SPORTS
"After watching all of the upset's on Friday, Royce White and Iowa State must be feeling awfully confident heading into their",SPORTS
He once vowed he'd work so hard for America that he wouldn't have time to hit the links.,POLITICS
"A few hours before Miguel Cotto challenged Sergio Martinez for the middleweight championship, Ray ""Boom Boom"" Mancini told me, ""Everyone thinks the way to beat a southpaw is with the straight right down the middle, but it's really the left hook.""",SPORTS
"It can be tough to find the perfect wallpaper. After searching through books at your local home improvement store, you might",HOME & LIVING
"“It is the biggest thing I’ve ever seen in lawn and garden.""",POLITICS
