short_description,category
Airport cellphone waiting areas are starting to look like fast-food drive-ins. A number of airports are allowing food trucks,TRAVEL
"Although its artist says, ""I still think I made him look like Lurch.""",SPORTS
"""You don't have a cold for two weeks ... you don't have headaches, throwing up, weaknesses for two weeks.""",SPORTS
"If you thought you had the coolest house, we’re about to school you.",HOME & LIVING
Sanders is 9 points ahead of Clinton in New Hampshire and trails by 11 points in Iowa.,POLITICS
Think outside groups aren't forces of destruction? Just ask the former speaker.,POLITICS
Virgin Atlantic doesn't belong to any of the big three airline alliances and the airline commands a coveted 304 slots at Heathrow.,TRAVEL
"Laser cut paper easily passes for lace, making it perfect for wedding details. Depending on the design, it can read romantic",HOME & LIVING
Trans people are enlisting in the military. Trump's voter fraud commission is dead. And Steve Bannon has instigated an alt-right civil war. Happy New Year.,POLITICS
"Homeland Security declined to identify the 21 states, however.",POLITICS
"From fuel surcharges to resort fees to port charges, the travel industry's laundry list of ancillary costs grows. Here are some of the fees you should watch out for, along with advice on avoiding the nickel-and-diming when possible.",TRAVEL
"And reader, if you haven't learned the taste of that kind of love yet, I hope you do. I thought of giving up. There was no",TRAVEL
"Imagine walking in dark long corridors that lead into 15 colorful rooms, each one is different from the other. Imagine opening each room's door, not knowing what to expect. But each room is a marvelous surprise. This is how I felt while I was shooting Alma Hotel.",TRAVEL
It was Germany's first gold in women's soccer.,SPORTS
The return of ailing Sen. John McCain suggests the Senate leader may have a plan for reviving Obamacare repeal.,POLITICS
FlightAware.com reports more than 358 flights have been canceled coming into and out of San Francisco. Flight Aware's CEO,TRAVEL
"Perhaps unsurprisingly, the subscriptions are riddled with hidden costs. Flyers seeking to check two bags will have to pay",TRAVEL
Cincinnati Bengals defensive tackle Devon Still shared some great news about his daughter.,SPORTS
"The Kansas Statehouse is one of the most ornate in the country. For a while, wherever my family traveled – New Hampshire",POLITICS
"Legend has it that when Dom Perignon first discovered champagne, he called out, ""Come quickly, I am tasting the stars!"" It's hard to disagree with the Frenchman -- a cool glass of bubbly can make even the most stoic person let loose a giggle or a smirk.",TRAVEL
"So any liability in the lawsuit filed by protesters ""must be shifted"" to the president, he argues.",POLITICS
"An official with the local union told the site that failures by the TSA workers were likely due to poor training, noting",TRAVEL
"Live from Iowa, it's Saturday night!",POLITICS
The issue has long perplexed lower courts and alarmed privacy advocates.,POLITICS
"Republican Party judges people for ""who they love"" but won't reject a ""pedophile,"" says Michael Steele.",POLITICS
Does anyone have a Draymond charger?,SPORTS
Billionaire real estate mogul Donald Trump won the Republican presidential primary in North Carolina on Tuesday. Heading,POLITICS
A significant travel bargain right now---and this is even during the high season--is Kenya where skies are brilliant blue and more than 2 million wildebeest and zebra have migrated from Tanzania into the legendary Masai Mara.,TRAVEL
After the Cards were presented with the Warren C. Giles Trophy by honorary league president Bill Giles before the delirious,SPORTS
"It's hard to ignore the calendar, but, um...we've all been guilty of not realizing a holiday is upon us until it's almost",HOME & LIVING
"The North Korean government is considered one of the world's most brutal, offering its people prison camps and mass starvations",SPORTS
"When the All-Star pitcher was dealt to Boston, it was the fourth time he was traded in six years.",SPORTS
This will be first time an MLB team plays in Cuba since 1999.,SPORTS
The National Football League was on the clock.,SPORTS
"this, We'd all like to do it. Hold on to the last slivers of summer before we hang up our bikinis and swim trunks for our",TRAVEL
In the summertime microwaves are a great alternative to cooking in our ovens. But with a lot of use it's bound to become,HOME & LIVING
"Organizing games or entertainment and forcing everyone to get involved (25%) The survey, which was conducted among 2,010",HOME & LIVING
Did you know bringing the outdoors in can help relieve tension?,HOME & LIVING
"The embattled far-right House member tried to explain her ""Marshall law"" text and we're confused.",POLITICS
A coalition of conservative states led by Texas hopes to kill Obama’s signature immigration achievement.,POLITICS
A window box can enhance the overall appeal of your home and give your plants a great place to live. Eric shows you how to,HOME & LIVING
Marie Antoinette would love this.,HOME & LIVING
"Every week, in our roundup of weird Craigslist finds, you might be fortunate enough to find the perfect quirky addition to",HOME & LIVING
Click through our slideshow of photos from a Tokyo abandoned home and head over to My Science Academy for other eery images,HOME & LIVING
Architecture can be pretty powerful.,HOME & LIVING
"A passerby filmed an unidentified woman grasping the gates of the airport, testing to see if she was strong enough to withstand",TRAVEL
The Interior secretary’s move was immediately slammed as a political favor for Florida Gov. Rick Scott.,POLITICS
"NBA players and Twitter call out the ""heartless clown.""",SPORTS
Look if you dare.,TRAVEL
"Smart travelers know that being a frequent flyer is a game changer. As a member of an airline's frequent flyer program, you'll",TRAVEL
"His bosses were furious. Roger Goodell knew it. So on April 1, 2008, the NFL commissioner convened an emergency session of",SPORTS
"“Here we go again with you’re guilty until proven innocent,"" Trump said.",POLITICS
"We're still learning new things about each other, asking questions as we put ourselves in new situations and refitting the puzzle pieces of our personalities into different pictures as our love matures.",TRAVEL
"Autumn is a season that calls our attention to Nature. It is a beautiful time of year, and I say ""Embrace it!""",HOME & LIVING
"Have something to say? Check out HuffPost Home on Twitter, Facebook, Pinterest, Tumblr and Instagram. ** Scroll through to",HOME & LIVING
"A few foreign films and the ensemble comedy ""Mother's Day"" also made the ranking.",HOME & LIVING
"We took the boat trip because we love traveling in Britain, and we love the serenity of hotel barging. The boat seemed to glide across glass like water, and it rose and fell effortlessly when it we went through locks.",TRAVEL
"H/T: Like Cool We've seen some weird design choices in homes, but artist Jun Kitagawa's giant zipper installation pretty",HOME & LIVING
"There are just so many things to consider before tying the knot, that brides-to-be can often forget about themselves -- and the importance of maintaining their own sanity -- amidst all the hustle and bustle.",TRAVEL
"As Team USA racks up wins, the president has been unusually silent.",POLITICS
"Brothers Paul and Gary O’Donovan are being hailed as ""Ireland's gift to the world.""",SPORTS
"If your kitchen's design makes you feel like you should be grooving to the Village People, it's probably time for an upgrade. And there are plenty of ways to make your kitchen stylish again without calling a contractor and dipping into your savings.",HOME & LIVING
"There's a new health adage out now: ""Sitting is the new smoking."" So I increased my workouts one day a week, I swapped my backpack for a pannier that clips to my commuter bicycle, and set to build a standing desk.",HOME & LIVING
The team plans to wear the patch all year to commemorate the shooting at Marjory Stoneman Douglas High School.,SPORTS
"Maybe it's because we love writing and all the letters and symbols that make up our language, but we think this playful chair",HOME & LIVING
"""In sickness and in health.""",SPORTS
Awkward.,SPORTS
"This is not an area dotted with little Hansel-and-Gretel-style cottages, for the Burgenlanders are a practical people who live in minimally decorated, comfortable stucco homes.",TRAVEL
We traveled to this beautiful haven along the Central Coast nestled near the historic town of Avila beach. We were told that,TRAVEL
Just a little U.S. Open tune-up.,SPORTS
They're about to increase it by $700 billion -- with business getting 60 percent of the benefit.,POLITICS
"Sourwood Caladium Genus: Antirrhinum majus 'Snap Daddy' Zones: All Zones Cost: $6 Expert says: ""This long-blooming snapdragon",HOME & LIVING
"We've got you covered for your ""Party in the U.S.A.""",HOME & LIVING
"A tour of Italian milkshakes, biscotti, tortes, and brioche -- it's enough to make our sugar-coated hearts pitter-patter with joy. We're lucky that third-generation gelato maker Silvana Vivoli of Florence is taking us on tour of her favorite local sweet spots.",TRAVEL
Going inside the mind of the five-time national champion coach and three-time Olympic gold medalist head coach.,SPORTS
"The allure of space travel and exploring the cosmos has enchanted tourists for decades. The Soviet Union's launch of Sputnik 1, an artificial satellite, in 1957 is credited with starting the ""space race;"" and the world's interest in space exploration skyrocketed.",TRAVEL
"""Everybody stop talking now. Attention.""",SPORTS
"""This is the best TV I ever watched. Real reality!""",TRAVEL
"Brush ya shoulders off, Ronda.",SPORTS
"During the game, a teenage spectator called Sydney Swans forward Adam Goodes-- who is Indigenous-- an ""ape"" as he ran by",SPORTS
The police recognized him immediately and posed for a picture with him after the incident.,SPORTS
Photo by Karen from The Art of Doing Stuff Fall is the perfect season to be outdoors -- no oppressive summer heat and no,HOME & LIVING
"Not only is the American bittersweet a multifaceted plant in one's garden but it can also be part of your cut-flower arsenal. Before the birds gobble up the tempting berries, cut off a couple of misdirected branches and bring them inside.",HOME & LIVING
"Ever since I first saw pictures of the mystifying red rocks of Utah, I wanted to visit Arches National Park. After looking at the map, however, the place seemed so remote that I wasn't sure I'd ever get there.",TRAVEL
Notre Dame and Baylor are the first two teams currently ranked outside the playoffs.,SPORTS
The policy has also been ruled unconstitutional.,POLITICS
One glance through ELLE Decor's March 2012 issue and you can see why the magazine is at the top of the shelter category: Great,HOME & LIVING
"Where to go if you're looking for romance, adventure or just a great boardwalk.",TRAVEL
"Most seats are made from polyester, plastic or polypropylene because these materials are durable, washable, dry quickly and",HOME & LIVING
The second no-no in the major leagues in just over a week.,SPORTS
"Do you ever look around your home, and feel suffocated by all your stuff? If so, the new year is a perfect time for a fresh start.",HOME & LIVING
"Mike Pence defends his boss: ""I trust Donald Trump's judgment.""",POLITICS
GOP divisions played only a minor role.,POLITICS
The U.S. will default on its debts on Nov. 3 if Congress doesn't take action.,POLITICS
The Washington Nationals infielder became a hurler for one gross moment — which was caught on video — against the San Francisco Giants.,SPORTS
Two senators were among those calling for his resignation as widespread sexual abuse of athletes came to light.,SPORTS
This entry has expired,TRAVEL
Jeb Bush's wealthy donors probably aren't feeling great.,POLITICS
It's the first time in the men's NCAA tournament a No. 16 seed has defeated a No. 1 seed.,SPORTS
So now you can stock up on chips and beer.,HOME & LIVING
Brady has been vindicated -- for now.,SPORTS
"Years of work and millions of dollars have revamped the Malecon into an eye-popping, 12-block-long art show peppered by dozens of sculptures, mosaics and paintings along with all kinds of indoor and outdoor galleries.",TRAVEL
Almost five years after the 2010 Deepwater Horizon spill sent millions of barrels of oil gushing into the Gulf of Mexico,POLITICS
"With spring break upon us and summer vacation just around the corner, parents are once again faced with the age-old debate: When it comes to international travel with kids in tow, how old is old enough for children to truly appreciate a trip abroad?",TRAVEL
What's happening in my town makes me worry for the future of our democracy as well as our ability to deal with issues like climate and pollution at the local level.,POLITICS
"The former San Francisco 49ers quarterback has been out of the league since the season when he began to protest racial injustice, becoming a civil rights leader.",SPORTS
"Since 1998, U.S. and Canada have met on every final except at the 2006 Turin Olympics.",SPORTS
The president may have shot himself in the foot by telling “Fox & Friends” that Cohen only performed a tiny bit of his legal work.,POLITICS
“It matters to show up. [Our legislators] need to see us.”,POLITICS
It's a bleak possibility for the not-too-distant future.,POLITICS
A man of passion.,SPORTS
"Obama also saw a performance of excerpts from ""Hamlet.""",POLITICS
Architect Craig Steely will turn your idea of Hawaii living on its head. The black lava fields that surround his modern designs,HOME & LIVING
"Death is a fact of life, but for many, it's a real estate dealbreaker.",HOME & LIVING
"""The guilt of being alive is heavy.""",POLITICS
"With spring being the busiest time for real estate, homeowners planning to put their homes on the market shouldn't wait for flowers to bloom before getting ready to sell.",HOME & LIVING
Wanderlust activated. 😍,TRAVEL
"2. Set A Timer, Grab A Big Bin Put anything that's supposed to be in the bedroom but isn't, into the bin. Setting a timer",HOME & LIVING
You'll probably believe what happened next.,POLITICS
"In our quest for unique DIY projects we come across a lot of really cool ideas, but we have to say, this one really impressed",HOME & LIVING
"Our friends at The Pinnacle List shared photos of this stunner, which is located in the suburb of Bantry Bay near the Lion’s",HOME & LIVING
"Sanders scored big fundraising and online victories, even though pundits declared Clinton the victor.",POLITICS
Clinton has won the vast majority of union endorsements this cycle.,POLITICS
"Traveling can be exhilarating and exhausting, inspiring and intimidating all at once. But with every personal connection",TRAVEL
Larry Wilmore’s provocative monologue at the White House correspondents’ dinner Saturday is still reverberating through,POLITICS
Trump’s legal team seems to be stepping into every legal trap Stormy Daniels and Michael Avenatti are laying for it.,POLITICS
Rob Refsnyder makes the highlight reels for all the wrong reasons.,SPORTS
Congratulations!,POLITICS
Do you have a home story idea or tip? Email us at homesubmissions@huffingtonpost.com. (PR pitches sent to this address will,HOME & LIVING
"Spaniards do celebrate Christmas by spending holiday meals together, giving presents and lighting up spectacular decorations around the city centers, but many traditions are unique to their culture.",TRAVEL
"The ""table"" just didn't look good on Jslow. Its awkwardly elevated height, cutting her off just below the boobs, produced a matronly, dowdy, squat silhouette",HOME & LIVING
Do you have a home story idea or tip? Email us at homesubmissions@huffingtonpost.com. (PR pitches sent to this address will,HOME & LIVING
"Anonymous Biden allies are telling news outlets the Indigenous congresswoman is not qualified. ""Of course it's offensive,"" said Rep. Raul Grijalva (D-Ariz.).",POLITICS
"After solving the Mideast, this should be cakewalk.",POLITICS
"Of the 68 teams that started the 2014 NCAA Tournament, there are finally just four left: Florida, Kentucky, Wisconsin and",SPORTS
We bet you're busy getting ready for some spook-tacular celebrations.,HOME & LIVING
"I'm not a big believer in pre-planning every single detail -- sometimes the best vacation moments are spontaneous. But unless your rich uncle is paying for the trip, you'll need to do a certain amount of preparation or your budget will fly out the window.",TRAVEL
"Short of crossing the border, you probably won’t find better Mexican food anywhere than in San Antonio. It is a staple for",TRAVEL
"They broke MLB barriers for female coaches, players and announcers.",SPORTS
Colbert never had a chance.,SPORTS
"""I would be very concerned with Mr. Trump's ability to know what he can and can't discuss.""",POLITICS
"Donald Trump’s pick for attorney general, long a climate denier, gave a bizarre interview about global warming in 2015.",POLITICS
"There's nothing like cooling temperatures to make families start yearning for the sand, surf and sun. Here are five deals",TRAVEL
"We're watching you, Mark.",POLITICS
It's the team's eighth world champion gold medal and its first big win for fair pay.,SPORTS
Art museums used to pale in comparison to the parade on the street.,TRAVEL
"So if you go to Cars Land, consider visiting at night. Then Lasseter proceeded to reveal on a big screen animated ""Cars""-like",TRAVEL
Was inducted into the WWE Hall of Fame in 2007.,SPORTS
"It's pretty rare that my best friend and I get away for our own mini-break, and it's even rarer that we get the chance to take on a new adventure. But if you've read any of my previous travel posts here on the blog, you know that if there is some kind of adventure sport to try, I'm going to try it.",TRAVEL
"I know we aren't the only family that struggles with how to manage screen time, find meaningful ways to connect, and genuinely enjoy each other. After a weekend in the woods, I realized camping was the very reason we were able to disconnect, and thereby reconnect, so easily.",TRAVEL
This is probably the stuff that fairytales are made of.,HOME & LIVING
Barcelona have been crowned Primera Division champions for the 24th time after a Luis Suarez hat trick saw them to a 3-0,SPORTS
Barack Obama should use his powers as President of the United States and pardon the three Cubans that are still imprisoned. This will have the immediate effect of freeing Alan Gross and improving relations between Washington and Havana.,POLITICS
And that's an order.,SPORTS
How does he do that?,SPORTS
President Obama's legacy is being tarnished for having been engaged in seven foreign wars in third world countries during two terms presidency including the U.S. - Afghanistan war which is now in its 15th year.,POLITICS
Heartbreak in Milwaukee.,SPORTS
"It wasn't until I became a permanent migrant to the aisle that I realized that the person in the window seat is really truly the person that holds the entire power, often in ways that aren't fully appreciated.",TRAVEL
New data obtained by HuffPost shows hate crimes rose nationally in 2016. The numbers for 2017 aren't looking great either.,POLITICS
There were 4.65 million homes bought last year in the U.S. Now multiply that number by five. That's (roughly) how many friends,HOME & LIVING
Take. off. your. headphones.,TRAVEL
The jam session was not the first performance enjoyed by a group of shocked travelers. The Copenhagen Philharmonic played,TRAVEL
...and people are loving every snide minute of it.,SPORTS
"By Jose Martinez, Complex Sports These last few days of college football action have been memorable ones. First, we had the",SPORTS
Experts say seismic testing to find drill sites could harm thousands of animals and affect coastal communities.,POLITICS
"So, are you packing your bags yet? They've done their research and found the cities with the lowest rent that also have the",HOME & LIVING
"Nearly a year and a half later, Greg Hardy has yet to apologize for his domestic violence offense.",SPORTS
"As the Trump White House desperately seeks solid footing amid a flood of controversy, its head finds himself amid a pall of his own making.",POLITICS
"Have something to say? Be sure to check out Stylelist Home on Twitter, Facebook and Pinterest. Add those ingredients together",HOME & LIVING
There's nothing like a beautiful beach with cool saltwater air. But add a delicious snack -- whether it's locally sourced seafood or a frozen sugary treat -- and your beach experience will surely be elevated to a heavenly degree.,TRAVEL
Improve your home over the next few days.,HOME & LIVING
"A thousand political obituaries would be written; a hundred stunned DC pundits would be asking themselves how this could have possibly happened. And in all this conversation, a major underlying narrative would be about the rising progressive tide shaking up Democratic politics.",POLITICS
"Even in the digital age, road trips remain a classic American pastime. Why are they so popular?  Hitting the open road takes us out of our comfort zone, literally and figuratively. Here's a guide to the best routes in the Southeast U.S., as well as some great tips for your next road trip.",TRAVEL
But the battle for gender equality in sponsorship deals continues.,SPORTS
Thank God for the electoral college.,POLITICS
Knitting's not just for grandmas.,HOME & LIVING
For nearly half a century the Voting Rights Act has stood as a central pillar in the protection of fair voting practices.  Our nation now faces the greatest threat to voting rights since Reconstruction.,POLITICS
And irony is dead.,POLITICS
"From removing tough toilet stains to cleaning your oven trays in the bath, these will keep you busy.",HOME & LIVING
They've used Tasers in at least 84 other incidents since 2011.,POLITICS
"As expected, Tom Brady filed his appeal last week. The NFLPA made the letter public on Friday, making the main appeal points available for all to see. They make three points, one of which we are going to discuss.",SPORTS
"The president feuds with members of his own party, who wish he would leave the tax details to them.",POLITICS
"The Sri Lankan city of Anuradhapura: I'll take a mostly-deserted hot mess of a sacred city over a tourist-infested, well put-together one any day.",TRAVEL
There's no need to spend money on expensive holders from the garden center.,HOME & LIVING
Voters are already gearing up for midterm elections.,POLITICS
The long march of the conservative movement has led the party from a majority to a minority that increasingly opposes democracy.,POLITICS
"Not a single ""Romo hater"" has a legitimate reason for their position in my opinion. Sure, you haven't won a Super Bowl, but I highly doubt than any other quarterback would have won a ring on those teams.",SPORTS
"It was so good, the umps didn't know if it was legal or not.",SPORTS
Beccaauuse no flight attendant is going to say your bag is not making it on the flight and goodbye! to every piece of clothing you own. You officially now have to wear the same outfit every day.,TRAVEL
Whoops!!!,SPORTS
"Tiger Woods shot 5-under 67 on Friday at the WGC-Cadillac Championship, but he still has seven shots to make up on leader",SPORTS
"No surprises here, the average price of California hotels is the highest you'll find when booking your summer vacation this year.",TRAVEL
The sled threat may jeopardize the island's first Olympic female bobsledders' shot at competing in Pyeongchang.,SPORTS
"** When you picture living in a mobile home, thoughts of ""roughing it"" in tiny cramped quarters come to mind, right? Well",HOME & LIVING
The GOP congressman was skewered on Twitter for the suggestion.,POLITICS
"And in most states, they're available for only $250,000 – $370,000.",HOME & LIVING
The former secretary of state is the latest George W. Bush administration veteran to back the Democrat.,POLITICS
This really doesn't seem like a such a bad idea.,HOME & LIVING
Staff is cagey about how much time president spends golfing on pricey trips to his resort.,POLITICS
"I’m not going to lie — I regret going to college. Don’t get me wrong, I learned a lot of stuff, sure. But that was years",TRAVEL
"A few minutes pass and she pops up beside me again, out of nowhere, and grabs my hand. ""Follow me,"" she says, like my very own White Rabbit.",TRAVEL
Legal experts have said court challenges to Trump’s decision could face an uphill battle.,POLITICS
"Over 20 different ships and nearly a dozen cruise lines visit ports around New York and some, such as the new Disney Magic, are even based at them year round.",TRAVEL
"MINNEAPOLIS (AP) — Flip Saunders, the longtime NBA coach who won more than 650 games in nearly two decades and was trying",SPORTS
"“We see racial justice and racial economic equality as part of the same agenda.""",POLITICS
"""It's pretty meaningless,"" he said.",SPORTS
A bizarre tale of power struggles and alternative medicine.,SPORTS
And puts on her gold medal in public for the first time in 40 years.,SPORTS
"You're safe now, lil' gadget.",SPORTS
The Colombian beauty has so much up her sleeve.,HOME & LIVING
"GOP hopes it will ""delight conservative voters."" President Obama will veto it immediately.",POLITICS
"The wingback armchair is back—and this time around, its shape is pleasingly streamlined. The design dates to the late 1700s",HOME & LIVING
Not a bad person to have on your side.,SPORTS
"""Fidel fears many things, and when you fear so much, you cannot love at the same time.""",TRAVEL
"The secret is to actually add furnishings, not subtract.",HOME & LIVING
